<?xml version="1.0" encoding="UTF-8"?>
<xs:schema xmlns:xs="http://www.w3.org/2001/XMLSchema"
           targetNamespace="http://example.org/users"
           xmlns="http://example.org/users"
           elementFormDefault="qualified">
  <xs:simpleType name="Gender">
    <xs:restriction base="xs:string">
      <xs:enumeration value="Male"/>
      <xs:enumeration value="Female"/>
    </xs:restriction>
  </xs:simpleType>
  <xs:element name="users">
    <xs:complexType>
      <xs:sequence>
        <xs:element name="user" maxOccurs="unbounded">
          <xs:complexType>
            <xs:sequence>
              <xs:element name="id" type="xs:int"/>
              <xs:element name="name">
                <xs:simpleType>
                  <xs:restriction base="xs:string">
                    <xs:maxLength value="32"/>
                  </xs:restriction>
                </xs:simpleType>
              </xs:element>
              <xs:element name="gender" type="Gender"/>
              <xs:element name="age" type="xs:int"/>
            </xs:sequence>
          </xs:complexType>
        </xs:element>
      </xs:sequence>
    </xs:complexType>
  </xs:element>
</xs:schema>
